{
  "trial_id": "00000000-0000-0000-0000-000000000001",
  "trace_id": "11111111111111111111111111111111",
  "attempt_token": "opaque-test-token",
  "lease_expires_at": "2026-10-25T09:01:00Z",
  "task": {
    "trial_id": "00000000-0000-0000-0000-000000000001",
    "instruction": "查询订单",
    "input": {
      "order_id": "A"
    },
    "deadline": "2026-10-25T10:00:00Z"
  }
}
